{
  "mission_id": "fixture",
  "version": 1,
  "title": "Fixture Mission",
  "setting": {
    "city": "Fixture City",
    "start_clock": "21:47",
    "minutes_available": 18
  },
  "companion": {
    "id": "maya",
    "name": "Maya",
    "mood_lines": {
      "curious": [
        "What do you notice here?",
        "Look around. Something is new."
      ],
      "encouraging": [
        "We are doing fine. One step at a time."
      ],
      "worried": [
        "Time is tight. Stay with me."
      ],
      "proud": [
        "You are really good at this."
      ]
    }
  },
  "flags": [
    {
      "id": "lost_ticket",
      "description": "Set when checkpoint 3 is missed."
    },
    {
      "id": "wrong_platform",
      "description": "Set when checkpoint 6 is missed."
    }
  ],
  "start_node": "intro",
  "nodes": [
    {
      "id": "intro",
      "kind": "narrative",
      "scene": {
        "location": "Fixture concourse",
        "backdrop": "fixture_scene",
        "lines": [
          {
            "speaker": "narrator",
            "text": "FIXTURE - 21:47. You have 18 minutes before the last train."
          }
        ]
      },
      "diary": "We started the fixture mission with eighteen minutes to spare.",
      "maya": {
        "line": "Fixture Maya here. Let us find that train."
      }
    },
    {
      "id": "c01",
      "kind": "checkpoint",
      "item_id": "q01",
      "scene": {
        "location": "Fixture stop 1",
        "backdrop": "fixture_scene",
        "lines": []
      },
      "diary": "We reached checkpoint 1.",
      "maya": {
        "intro": "Fixture intro for checkpoint 1: pay attention.",
        "reaction_ok": "Checkpoint 1: you understood.",
        "reaction_fail": "Checkpoint 1: not quite. We take the long way."
      }
    },
    {
      "id": "c01_ok",
      "kind": "consequence",
      "scene": {
        "location": "Fixture stop 1",
        "backdrop": "fixture_scene",
        "lines": [
          {
            "speaker": "narrator",
            "text": "Checkpoint 1 understood. The story moves on."
          }
        ]
      },
      "diary": "Checkpoint 1 understood. The story moves on."
    },
    {
      "id": "c01_fail",
      "kind": "consequence",
      "scene": {
        "location": "Fixture stop 1",
        "backdrop": "fixture_scene",
        "lines": [
          {
            "speaker": "narrator",
            "text": "Checkpoint 1 missed. A short detour."
          }
        ]
      },
      "diary": "Checkpoint 1 missed. A short detour."
    },
    {
      "id": "c02",
      "kind": "checkpoint",
      "item_id": "q02",
      "scene": {
        "location": "Fixture stop 2",
        "backdrop": "fixture_scene",
        "lines": [
          {
            "speaker": "narrator",
            "text": "Placeholder scene for checkpoint 2."
          }
        ]
      },
      "diary": "We reached checkpoint 2.",
      "maya": {
        "intro": "Fixture intro for checkpoint 2: pay attention.",
        "reaction_ok": "Checkpoint 2: you understood.",
        "reaction_fail": "Checkpoint 2: not quite. We take the long way."
      }
    },
    {
      "id": "c02_ok",
      "kind": "consequence",
      "scene": {
        "location": "Fixture stop 2",
        "backdrop": "fixture_scene",
        "lines": [
          {
            "speaker": "narrator",
            "text": "Checkpoint 2 understood. The story moves on."
          }
        ]
      },
      "diary": "Checkpoint 2 understood. The story moves on."
    },
    {
      "id": "c02_fail",
      "kind": "consequence",
      "scene": {
        "location": "Fixture stop 2",
        "backdrop": "fixture_scene",
        "lines": [
          {
            "speaker": "narrator",
            "text": "Checkpoint 2 missed. A short detour."
          }
        ]
      },
      "diary": "Checkpoint 2 missed. A short detour."
    },
    {
      "id": "c03",
      "kind": "checkpoint",
      "item_id": "q03",
      "scene": {
        "location": "Fixture stop 3",
        "backdrop": "fixture_scene",
        "lines": [
          {
            "speaker": "narrator",
            "text": "Placeholder scene for checkpoint 3."
          }
        ]
      },
      "diary": "We reached checkpoint 3.",
      "maya": {
        "intro": "Fixture intro for checkpoint 3: pay attention.",
        "reaction_ok": "Checkpoint 3: you understood.",
        "reaction_fail": "Checkpoint 3: not quite. We take the long way."
      }
    },
    {
      "id": "c03_ok",
      "kind": "consequence",
      "scene": {
        "location": "Fixture stop 3",
        "backdrop": "fixture_scene",
        "lines": [
          {
            "speaker": "narrator",
            "text": "Checkpoint 3 understood. The story moves on."
          }
        ]
      },
      "diary": "Checkpoint 3 understood. The story moves on."
    },
    {
      "id": "c03_fail",
      "kind": "consequence",
      "scene": {
        "location": "Fixture stop 3",
        "backdrop": "fixture_scene",
        "lines": [
          {
            "speaker": "narrator",
            "text": "Checkpoint 3 missed. A short detour."
          }
        ]
      },
      "diary": "Checkpoint 3 missed. A short detour."
    },
    {
      "id": "c04",
      "kind": "checkpoint",
      "item_id": "q04",
      "scene": {
        "location": "Fixture stop 4",
        "backdrop": "fixture_scene",
        "lines": [
          {
            "speaker": "narrator",
            "text": "Placeholder scene for checkpoint 4."
          }
        ],
        "variants": [
          {
            "when_flag": "lost_ticket",
            "lines": [
              {
                "speaker": "narrator",
                "text": "Flag lost_ticket is set at checkpoint 4."
              }
            ],
            "maya_line": "Remember what happened before. Checkpoint 4."
          }
        ]
      },
      "diary": "We reached checkpoint 4.",
      "maya": {
        "intro": "Fixture intro for checkpoint 4: pay attention.",
        "reaction_ok": "Checkpoint 4: you understood.",
        "reaction_fail": "Checkpoint 4: not quite. We take the long way."
      }
    },
    {
      "id": "c04_ok",
      "kind": "consequence",
      "scene": {
        "location": "Fixture stop 4",
        "backdrop": "fixture_scene",
        "lines": [
          {
            "speaker": "narrator",
            "text": "Checkpoint 4 understood. The story moves on."
          }
        ]
      },
      "diary": "Checkpoint 4 understood. The story moves on."
    },
    {
      "id": "c04_fail",
      "kind": "consequence",
      "scene": {
        "location": "Fixture stop 4",
        "backdrop": "fixture_scene",
        "lines": [
          {
            "speaker": "narrator",
            "text": "Checkpoint 4 missed. A short detour."
          }
        ]
      },
      "diary": "Checkpoint 4 missed. A short detour."
    },
    {
      "id": "c05",
      "kind": "checkpoint",
      "item_id": "q05",
      "scene": {
        "location": "Fixture stop 5",
        "backdrop": "fixture_scene",
        "lines": [
          {
            "speaker": "narrator",
            "text": "Placeholder scene for checkpoint 5."
          }
        ]
      },
      "diary": "We reached checkpoint 5.",
      "maya": {
        "intro": "Fixture intro for checkpoint 5: pay attention.",
        "reaction_ok": "Checkpoint 5: you understood.",
        "reaction_fail": "Checkpoint 5: not quite. We take the long way."
      }
    },
    {
      "id": "c05_ok",
      "kind": "consequence",
      "scene": {
        "location": "Fixture stop 5",
        "backdrop": "fixture_scene",
        "lines": [
          {
            "speaker": "narrator",
            "text": "Checkpoint 5 understood. The story moves on."
          }
        ]
      },
      "diary": "Checkpoint 5 understood. The story moves on."
    },
    {
      "id": "c05_fail",
      "kind": "consequence",
      "scene": {
        "location": "Fixture stop 5",
        "backdrop": "fixture_scene",
        "lines": [
          {
            "speaker": "narrator",
            "text": "Checkpoint 5 missed. A short detour."
          }
        ]
      },
      "diary": "Checkpoint 5 missed. A short detour."
    },
    {
      "id": "c06",
      "kind": "checkpoint",
      "item_id": "q06",
      "scene": {
        "location": "Fixture stop 6",
        "backdrop": "fixture_scene",
        "lines": [
          {
            "speaker": "narrator",
            "text": "Placeholder scene for checkpoint 6."
          }
        ]
      },
      "diary": "We reached checkpoint 6.",
      "maya": {
        "intro": "Fixture intro for checkpoint 6: pay attention.",
        "reaction_ok": "Checkpoint 6: you understood.",
        "reaction_fail": "Checkpoint 6: not quite. We take the long way."
      }
    },
    {
      "id": "c06_ok",
      "kind": "consequence",
      "scene": {
        "location": "Fixture stop 6",
        "backdrop": "fixture_scene",
        "lines": [
          {
            "speaker": "narrator",
            "text": "Checkpoint 6 understood. The story moves on."
          }
        ]
      },
      "diary": "Checkpoint 6 understood. The story moves on."
    },
    {
      "id": "c06_fail",
      "kind": "consequence",
      "scene": {
        "location": "Fixture stop 6",
        "backdrop": "fixture_scene",
        "lines": [
          {
            "speaker": "narrator",
            "text": "Checkpoint 6 missed. A short detour."
          }
        ]
      },
      "diary": "Checkpoint 6 missed. A short detour."
    },
    {
      "id": "c07",
      "kind": "checkpoint",
      "item_id": "q07",
      "scene": {
        "location": "Fixture stop 7",
        "backdrop": "fixture_scene",
        "lines": [
          {
            "speaker": "narrator",
            "text": "Placeholder scene for checkpoint 7."
          }
        ],
        "variants": [
          {